{
  "id": "b4000001-0002-4000-8000-000000000002",
  "organization_id": "b4000001-0000-4000-8000-000000000000",
  "name": "Airline Pre-Boarding Pass",
  "credential_type": "PreBoardingClearance",
  "description": "Digital pre-boarding pass issued to passengers who complete identity verification before arriving at the gate",
  "compliance_profile_id": "cp-enterprise-vc",
  "trust_profile_id": "b4000001-0003-4000-8000-000000000003",
  "revocation_profile_id": "rp-online-first-example",
  "claims": [
    {
      "name": "passenger_name",
      "type": "STRING",
      "description": "Full passenger name as on document",
      "required": true,
      "selectively_disclosable": true,
      "namespace": "org.icao.vds-nc.1"
    },
    {
      "name": "flight_number",
      "type": "STRING",
      "description": "Operating flight number",
      "required": true,
      "selectively_disclosable": false,
      "namespace": "org.example.airline.1"
    },
    {
      "name": "departure_date",
      "type": "DATE",
      "description": "Scheduled departure date (UTC)",
      "required": true,
      "selectively_disclosable": false,
      "namespace": "org.example.airline.1"
    },
    {
      "name": "seat_number",
      "type": "STRING",
      "description": "Assigned seat",
      "required": false,
      "selectively_disclosable": true,
      "namespace": "org.example.airline.1"
    },
    {
      "name": "boarding_group",
      "type": "STRING",
      "description": "Boarding priority group",
      "required": false,
      "selectively_disclosable": false,
      "namespace": "org.example.airline.1"
    },
    {
      "name": "cleared_at",
      "type": "STRING",
      "description": "Timestamp of identity clearance (ISO 8601)",
      "required": true,
      "selectively_disclosable": false,
      "namespace": "org.example.airline.1"
    }
  ],
  "validity_rules": {
    "ttl_seconds": 86400,
    "renewable": false
  },
  "issuer_did": "did:web:issuer.example-airline.com",
  "status": "ACTIVE",
  "created_at": "2026-03-11T00:00:00Z"
}
