{
  "id": "ct-minimal",
  "organization_id": "org-example",
  "name": "Minimal Credential Template",
  "credential_type": "MinimalCredential",
  "compliance_profile_id": "cp-enterprise-vc",
  "credential_payload_format": "SD_JWT_VC",
  "vct": "MinimalCredential",
  "issuer_did": "did:web:example.com",
  "validity_rules": {
    "ttl_seconds": 86400
  },
  "claims": [
    {
      "name": "subject_id",
      "type": "STRING",
      "required": true,
      "selectively_disclosable": false
    }
  ],
  "status": "ACTIVE",
  "created_at": "2026-03-11T00:00:00Z"
}
