{
  "id": "4bd47e7a-3a4f-4e6b-b8e2-5d7a2bcf1234",
  "organization_id": "9b1deb4d-3b7d-4bad-9bdd-2b0d7b3dcb6d",
  "name": "TD3 Digital Passport Package",
  "credential_type": "PassportDigitalHandoff",
  "compliance_profile_id": "cp-icao-passport-digital-handoff",
  "credential_payload_format": "ICAO_EMRTD",
  "issuer_did": "did:web:marty.example.test",
  "claims": [
    {"name": "data_group_1", "type": "STRING", "required": true},
    {"name": "data_group_2", "type": "STRING", "required": true},
    {"name": "sod", "type": "STRING", "required": true}
  ],
  "validity_rules": {"ttl_seconds": 31536000},
  "status": "DRAFT",
  "created_at": "2026-09-27T00:00:00Z"
}
