{
  "id": "ct-employee-badge-example",
  "organization_id": "b3000001-0000-4000-8000-000000000000",
  "name": "Employee Access Badge Template",
  "description": "Issues verifiable employee access credentials to enrolled staff. Credential authorizes physical and logical access based on clearance level. Requires manual HR approval prior to issuance.",
  "credential_type": "EmployeeAccessBadge",
  "compliance_profile_id": "b3000001-0005-4000-8000-000000000005",
  "credential_payload_format": "SD_JWT_VC",
  "vct": "EmployeeAccessBadge",
  "issuer_did": "did:web:identity.example-corp.com",
  "validity_rules": {
    "ttl_seconds": 86400,
    "renewable": true
  },
  "claims": [
    {
      "name": "employee_id",
      "type": "STRING",
      "required": true,
      "selectively_disclosable": false,
      "description": "Internal employee identifier (always disclosed)"
    },
    {
      "name": "given_name",
      "type": "STRING",
      "required": true,
      "selectively_disclosable": true,
      "description": "Employee given name — selectively disclosable"
    },
    {
      "name": "family_name",
      "type": "STRING",
      "required": true,
      "selectively_disclosable": true,
      "description": "Employee family name — selectively disclosable"
    },
    {
      "name": "department",
      "type": "STRING",
      "required": true,
      "selectively_disclosable": true,
      "description": "Department name — selectively disclosable"
    },
    {
      "name": "clearance_level",
      "type": "INTEGER",
      "required": true,
      "selectively_disclosable": false,
      "description": "Numeric clearance level 1–5 (always disclosed)"
    },
    {
      "name": "access_zones",
      "type": "ARRAY",
      "required": true,
      "selectively_disclosable": false,
      "description": "List of authorized physical access zone IDs (always disclosed)"
    },
    {
      "name": "employment_status",
      "type": "STRING",
      "required": true,
      "selectively_disclosable": false,
      "description": "Current employment status (always disclosed)"
    }
  ],
  "status": "ACTIVE",
  "created_at": "2026-03-11T00:00:00Z"
}
