{
  "id": "ct-loyalty-card-example",
  "organization_id": "b2000001-0000-4000-8000-000000000000",
  "name": "Loyalty Program Membership Credential Template",
  "description": "Issues an SD-JWT-VC loyalty card credential via OID4VCI pre-authorized code flow. Members receive a push notification with an OID4VCI offer URI and add the credential to their wallet.",
  "credential_type": "LoyaltyProgramMembership",
  "compliance_profile_id": "b2000001-0005-4000-8000-000000000005",
  "credential_payload_format": "SD_JWT_VC",
  "vct": "LoyaltyProgramMembership",
  "issuer_did": "did:web:credentials.example-issuer.com",
  "validity_rules": {
    "ttl_seconds": 31536000,
    "renewable": true
  },
  "claims": [
    {
      "name": "member_id",
      "type": "STRING",
      "required": true,
      "selectively_disclosable": false,
      "description": "Unique membership identifier (always disclosed)"
    },
    {
      "name": "tier",
      "type": "STRING",
      "required": true,
      "selectively_disclosable": false,
      "description": "Membership tier (always disclosed)"
    },
    {
      "name": "given_name",
      "type": "STRING",
      "required": true,
      "selectively_disclosable": true,
      "description": "Member given name (selectively disclosable)"
    },
    {
      "name": "family_name",
      "type": "STRING",
      "required": true,
      "selectively_disclosable": true,
      "description": "Member family name (selectively disclosable)"
    },
    {
      "name": "points_balance",
      "type": "INTEGER",
      "required": false,
      "selectively_disclosable": true,
      "description": "Current points balance (selectively disclosable)"
    },
    {
      "name": "enrolled_at",
      "type": "DATE",
      "required": true,
      "selectively_disclosable": true,
      "description": "Enrollment date (selectively disclosable)"
    },
    {
      "name": "benefits",
      "type": "ARRAY",
      "required": false,
      "selectively_disclosable": true,
      "description": "List of active benefit codes for this tier"
    }
  ],
  "revocation_profile_id": "rp-status-list-example",
  "status": "ACTIVE",
  "created_at": "2026-03-11T00:00:00Z"
}
